{
  "meta": {
    "name": "MetaCurtis Consciousness Theater",
    "version": "3.4",
    "authority": "ABSOLUTE",
    "date": "2025-09-06",
    "documentStatus": "SINGLE_SOURCE_OF_TRUTH",
    "mode": "TEXT_FIRST_REVEAL",
    "compat": { "accepts": ["3.3"] }
  },

  "features": {
    "gaussianFalloff": 1,
    "centerWeightingTier4": 1,
    "ctfOpening": false,
    "beatGlyph": true,
    "scrollOrchestrator": true,
    "openingFencepostContract": true
  },

  "pipeline": {
    "modules": {
      "director": {
        "role": "orchestration",
        "writes": ["eventsOnly"],
        "forbidden": ["geometry", "uniforms"],
        "notes": "Wait for ENGINE_VIEWPORT_HINT → (optional terminal overlay) → SCREEN_FILL fade → PARTICLES_START_EMERGING → expect BLUEPRINT_READY(mode:'emergence') then BLUEPRINT_READY(full genesis) → wait for PARTICLES_EMERGED (emit-once) → STAGE_CHANGE 'genesis' → settle morph 0→1 → ENABLE_SCROLL → START_NARRATIVE + AUDIO_START_STAGE."
      },
      "engine": {
        "role": "blueprint_author",
        "writes": ["blueprint"],
        "forbidden": ["gpuDraw"],
        "blueprintFields": [
          "atmosphericPositions",
          "text3DPositions",
          "tierData",
          "sizeMultiplier",
          "opacityData",
          "atlasIndex",
          "animationSeed",
          "activeCount",
          "particleCount",
          "maxParticles",
          "metadata"
        ],
        "opening": {
          "emergence": {
            "target": "random_to_random_gas_cloud",
            "blueprintEventMode": "emergence"
          }
        }
      },
      "renderer": {
        "role": "dumb_renderer",
        "writes": ["geometry", "uniforms"],
        "forbidden": ["fabricateTargets", "readScroll", "scaleByFov"],
        "singleWriter": true,
        "emits": ["ENGINE_VIEWPORT_HINT", "PARTICLES_EMERGED"],
        "emitOnceFencepost": true,
        "notes": "Emit ENGINE_VIEWPORT_HINT at mount/resize; bind emergence/full blueprints; emit PARTICLES_EMERGED exactly once after the first full genesis bind; may apply subtle mesh rotation during chaos window when PARTICLES_START_EMERGING is received."
      },
      "beatBus": {
        "role": "event_bus",
        "exposedGlobals": ["BeatBus", "EVENTS"]
      },
      "scrollOrchestrator": {
        "role": "progress_publisher",
        "writes": ["eventsOnly"],
        "forbidden": ["geometry", "uniforms"],
        "notes": "Maps window scroll→stage-local progress; publishes MORPH_PROGRESS; emits STAGE_CHANGE at breakpoints and MEMORY_FRAGMENT_TRIGGER from per-stage triggerPercent. Renderer remains a dumb sink."
      }
    },
    "singleWriterRules": [
      "Renderer is the ONLY geometry/uniform writer",
      "Engine is the ONLY blueprint author",
      "Director NEVER writes geometry/uniforms"
    ]
  },

  "shaderContract": {
    "attributes": [
      { "name": "position", "type": "vec3", "semantics": "current position" },
      { "name": "atmosphericPosition", "type": "vec3", "semantics": "morph source" },
      {
        "name": "text3DPosition",
        "type": "vec3",
        "semantics": "morph target (stage word/formation)"
      },
      { "name": "tierData", "type": "float", "range": [0, 3], "semantics": "tier id" },
      { "name": "sizeMultiplier", "type": "float", "semantics": "sprite scaling per particle" },
      { "name": "opacityData", "type": "float", "semantics": "base opacity per particle" },
      { "name": "atlasIndex", "type": "float", "semantics": "sprite index in atlas" },
      { "name": "animationSeed", "type": "vec3", "semantics": "per-particle randomization" },
      { "name": "particleIndex", "type": "float", "semantics": "0..N-1 (renderer-added)" }
    ],
    "uniforms": [
      { "name": "uTime", "type": "float" },
      {
        "name": "uMorphProgress",
        "type": "float",
        "range": [0, 1],
        "semantics": "0=atmospheric,1=target"
      },
      { "name": "uScrollProgress", "type": "float", "range": [0, 1] },
      { "name": "uStageIndex", "type": "int" },
      { "name": "uActiveCount", "type": "int" },
      { "name": "uTierCutoff", "type": "int" },
      { "name": "uColorCurrent", "type": "vec3" },
      { "name": "uColorNext", "type": "vec3" },
      { "name": "uColorAccent1", "type": "vec3" },
      { "name": "uColorAccent2", "type": "vec3" },
      { "name": "uAtlasTexture", "type": "sampler2D" },
      { "name": "uTotalSprites", "type": "int", "value": 16 },
      { "name": "uPointSize", "type": "float" },
      { "name": "uDevicePixelRatio", "type": "float" },
      { "name": "uResolution", "type": "vec2" },
      { "name": "uGaussianSigma", "type": "float" },
      { "name": "uTierHighlight", "type": "float[4]" },
      { "name": "uGaussianFalloff", "type": "float" },
      { "name": "uCenterWeighting", "type": "float" },
      { "name": "uStageProgress", "type": "float", "aliasOf": "uMorphProgress" },
      { "name": "uStageBlend", "type": "float", "aliasOf": "uScrollProgress" },
      {
        "name": "uChaosSpin",
        "type": "float",
        "optional": true,
        "semantics": "radians/sec multiplier during chaos"
      },
      { "name": "uTrailIntensity", "type": "float", "optional": true },
      { "name": "uTrailPersistence", "type": "float", "optional": true },
      { "name": "uBrightnessBoost", "type": "float", "optional": true }
    ]
  },

  "events": [
    {
      "name": "ENGINE_VIEWPORT_HINT",
      "emitter": "Renderer",
      "payload": { "width": "int", "height": "int", "aspect": "float" }
    },
    { "name": "PREWARM_GENESIS_BLUEPRINT", "emitter": "Director" },
    { "name": "PREWARM_COMPLETE", "emitter": "Engine", "payload": { "key": "string" } },
    { "name": "AUDIO_COMPUTER_HUM", "emitter": "Director", "payload": { "volume": "float[0..1]" } },
    { "name": "CURSOR_SHOW", "emitter": "Director" },
    {
      "name": "CURSOR_BLINK",
      "emitter": "Director",
      "payload": { "count": "int", "interval": "ms" }
    },
    {
      "name": "TERMINAL_TYPE",
      "emitter": "Director",
      "payload": { "lines": "string[]", "typeSpeed": "ms", "lineDelay": "ms" }
    },
    {
      "name": "SCREEN_FILL",
      "emitter": "Director",
      "payload": { "text": "string", "scrollSpeed": "ms" }
    },
    {
      "name": "BUILD_EMERGENCE_BLUEPRINT",
      "emitter": "Director",
      "payload": { "sourceText": "string", "count": "int" }
    },
    {
      "name": "BLUEPRINT_READY",
      "emitter": "Engine",
      "payload": { "stage": "string", "mode": "string|null" }
    },
    { "name": "PARTICLES_START_EMERGING", "emitter": "Director" },
    {
      "name": "PARTICLES_EMERGED",
      "emitter": "Renderer",
      "semantics": "emit_once_after_first_full_genesis_bind"
    },
    { "name": "STAGE_CHANGE", "emitter": "Director", "payload": { "stage": "string" } },
    { "name": "ENABLE_SCROLL", "emitter": "Director" },
    {
      "name": "QUALITY_CHANGE",
      "emitter": "Director",
      "payload": { "tier": "LOW|MEDIUM|HIGH|ULTRA" }
    },
    { "name": "MORPH_PROGRESS", "emitter": "Director", "payload": { "value": "float[0..1]" } },
    { "name": "START_NARRATIVE", "emitter": "Director", "payload": { "stage": "string" } },
    { "name": "AUDIO_START_STAGE", "emitter": "Director", "payload": { "stage": "string" } },
    { "name": "MORPH_TO_BEATGLYPH", "emitter": "Director", "payload": { "text": "string" } },
    { "name": "MEMORY_FRAGMENT_TRIGGER", "emitter": "Director", "payload": { "id": "string" } }
  ],

  "openingFencepost": {
    "order": [
      "ENGINE_VIEWPORT_HINT (Renderer)",
      "PREWARM_GENESIS_BLUEPRINT (Director)",
      "TERMINAL_TYPE / SCREEN_FILL (Director, optional overlay)",
      "PARTICLES_START_EMERGING (Director)",
      "BLUEPRINT_READY { mode:'emergence', stage:'genesis' } (Engine)",
      "BLUEPRINT_READY { stage:'genesis' } full (Engine)",
      "PARTICLES_EMERGED (Renderer, emit_once)",
      "STAGE_CHANGE { stage:'genesis' } (Director)",
      "MORPH_PROGRESS settle → 1.0 (Director)",
      "ENABLE_SCROLL (Director)",
      "START_NARRATIVE { stage:'genesis' } & AUDIO_START_STAGE { stage:'genesis' } (Director)"
    ]
  },

  "openingRules": {
    "startAfterViewportHint": true,
    "stage0ColorLock": true,
    "scrollLockedUntil": "ENABLE_SCROLL",
    "emergenceModeRequired": true
  },

  "quality": {
    "multipliers": { "LOW": 0.3, "MEDIUM": 0.6, "HIGH": 1, "ULTRA": 1.5 },
    "maxParticles": 15000
  },

  "scrollAndMorph": {
    "stageBreakpointsPercent": [0, 14, 28, 42, 56, 70, 84, 100],
    "easing": "exponential_inout_edges",
    "morphResponse": { "speedMultiplier": 2, "smoothing": 0.15, "overshoot": 0.05 },
    "ownership": { "publisher": "Director", "rendererReadsScroll": false }
  },

  "spriteSemantics": {
    "substrate": 7,
    "spatialCircles": [0, 1],
    "anchorDiamond": 4,
    "anchorCrystal": 11,
    "star": 6,
    "burst": 13,
    "galaxy": 15
  },

  "stageOrder": [
    "genesis",
    "discipline",
    "neural",
    "velocity",
    "architecture",
    "harmony",
    "transcendence"
  ],

  "stages": {
    "genesis": {
      "label": "GENESIS SPARK",
      "ordinal": 0,
      "scrollRangePercent": [0, 14],
      "particlesBase": 2000,
      "word": "HELLO CURTIS",
      "palette": ["#00FF00", "#22c55e", "#15803d"],
      "tierMix": [0.6, 0.2, 0.1, 0.1],
      "motionBehaviors": {
        "tier0": "drift_perlin_slow",
        "tier1": "orbital_micro",
        "tier2": "twinkle_soft",
        "tier3": "pulse_soft"
      },
      "camera": { "movement": "dolly_in", "degrees": 5, "shake": false },
      "morphProfile": {
        "arrival": 1,
        "easing": "smoothstep",
        "elasticity": { "amplitude": 0, "frequency": 0 }
      },

      "openingNote": "Opening shot list (implemented using the contracts above)",
      "openingTimeline": {
        "profile": "chaos_coalesce_settle_v1",
        "prologue": { "terminalOverlay": true, "fadeOutAtMs": 0 },
        "chaos": {